"Hash","Message","Filename","Source Code (before)","Source Code (current)","Diff","LLM Inference (fix type)","Rectified Message"
"a1b2c3d4","fix null pointer in user lookup","auth/user.py","def get_user_details(user_id):\n  user = db.query(user_id)\n  return user.name","def get_user_details(user_id):\n  user = db.query(user_id)\n  if user:\n    return user.name\n  return None","-  return user.name\n+  if user:\n+    return user.name\n+  return None","Logic Error","Fix: Prevent AttributeError by handling None for non-existent users in get_user_details."
"f4e5d6c7","perf: use set for faster lookups","data_processing/cleaner.py","def remove_duplicates(items):\n  unique_items = []\n  for item in items:\n    if item not in unique_items:\n      unique_items.append(item)\n  return unique_items","def remove_duplicates(items):\n  return list(set(items))","-  unique_items = []\n-  for item in items:\n-    if item not in unique_items:\n-      unique_items.append(item)\n-  return unique_items\n+  return list(set(items))","Performance","Refactor: Improve performance of duplicate removal by leveraging the O(1) average time complexity of set insertion."
"b7c8d9e0","typo fix in error msg","api/v1/errors.js","res.status(400).send({ error: 'Inavlid input provided.' });","res.status(400).send({ error: 'Invalid input provided.' });","-res.status(400).send({ error: 'Inavlid input provided.' });\n+res.status(400).send({ error: 'Invalid input provided.' });","Typo","Fix: Corrected a typo in the invalid input error message."
"c9d0e1f2","fix: off-by-one error in pagination","utils/pagination.py","def get_page_items(items, page, page_size):\n  start = (page - 1) * page_size\n  end = start + page_size - 1\n  return items[start:end]","def get_page_items(items, page, page_size):\n  start = (page - 1) * page_size\n  end = start + page_size\n  return items[start:end]","-  end = start + page_size - 1\n+  end = start + page_size","Logic Error","Fix: Corrected an off-by-one error in list slicing logic for pagination."
"d1e2f3a4","sec: use parameterized query to prevent sql injection","db/queries.py","def get_user(username):\n  query = f\"SELECT * FROM users WHERE username = '{username}'\"\n  return db.execute(query)","def get_user(username):\n  query = \"SELECT * FROM users WHERE username = ?\"\n  return db.execute(query, (username,))","-  query = f\"SELECT * FROM users WHERE username = '{username}'\"\n+  query = \"SELECT * FROM users WHERE username = ?\"\n-  return db.execute(query)\n+  return db.execute(query, (username,))","Security","Fix: Mitigated SQL injection vulnerability by using parameterized queries instead of string formatting."
"e3f4a5b6","refactor: simplify conditional","services/payment.js","function isEligible(user) {\n  if (user.is_active === true) {\n    return true;\n  } else {\n    return false;\n  }\n}","function isEligible(user) {\n  return user.is_active;\n}","-  if (user.is_active === true) {\n-    return true;\n-  } else {\n-    return false;\n-  }\n+  return user.is_active;","Refactoring","Refactor: Simplified boolean conditional return statement for clarity and conciseness."
"f5a6b7c8","docs: add comment explaining regex","utils/validation.py","EMAIL_REGEX = r'^[a-z0-9]+[\\._]?[a-z0-9]+[@]\\w+[.]\\w{2,3}$'","EMAIL_REGEX = r'^[a-z0-9]+[\\._]?[a-z0-9]+[@]\\w+[.]\\w{2,3}$' # Simple email regex","+ # Simple email regex","Documentation","Docs: Added a comment to clarify the purpose of the email validation regex."
"a7b8c9d0","fix: incorrect key access in dict","processing/parser.py","def get_name(data):\n  return data['username']","def get_name(data):\n  return data.get('name')","-  return data['username']\n+  return data.get('name')","Logic Error","Fix: Changed dictionary access from 'username' to 'name' and used .get() to avoid KeyError."
"b9c0d1e2","chore: update flask version","requirements.txt","Flask==2.0.1","Flask==2.1.0","-Flask==2.0.1\n+Flask==2.1.0","Dependency Update","Chore: Updated Flask dependency from version 2.0.1 to 2.1.0."
"c1d2e3f4","fix: async function needs await","api/v1/handlers.py","async def process_data():\n  result = some_async_db_call()\n  return result","async def process_data():\n  result = await some_async_db_call()\n  return result","-  result = some_async_db_call()\n+  result = await some_async_db_call()","Logic Error","Fix: Added missing 'await' keyword for an asynchronous database call."
"d3e4f5a6","refactor: use list comprehension","data/transformer.py","def square_numbers(numbers):\n  squared = []\n  for n in numbers:\n    squared.append(n*n)\n  return squared","def square_numbers(numbers):\n  return [n*n for n in numbers]","-  squared = []\n-  for n in numbers:\n-    squared.append(n*n)\n-  return squared\n+  return [n*n for n in numbers]","Refactoring","Refactor: Replaced for-loop with a more concise and pythonic list comprehension."
"e5f6a7b8","fix: handle divide by zero","analytics/metrics.py","def calculate_ratio(a, b):\n  return a / b","def calculate_ratio(a, b):\n  return a / b if b != 0 else 0","-  return a / b\n+  return a / b if b != 0 else 0","Logic Error","Fix: Added a check to prevent ZeroDivisionError when calculating ratio."
"f7a8b9c0","style: remove trailing whitespace","config.py","SECRET_KEY = 'my-secret' ","SECRET_KEY = 'my-secret'","-SECRET_KEY = 'my-secret' \n+SECRET_KEY = 'my-secret'","Style","Style: Removed trailing whitespace for code linting compliance."
"a9b0c1d2","test: add test for edge case","tests/test_utils.py","def test_normal_case():\n  assert my_func(10) == 20","def test_normal_case():\n  assert my_func(10) == 20\n\ndef test_zero_case():\n  assert my_func(0) == 0","+ \n+ def test_zero_case():\n+   assert my_func(0) == 0","Test","Test: Added a new unit test to cover the edge case where the input is zero."
"b1c2d3e4","fix: incorrect comparison operator","auth/permissions.js","if (user.role == 'admin') {\n  // grant access\n}","if (user.role === 'admin') {\n  // grant access\n}","-if (user.role == 'admin')\n+if (user.role === 'admin')","Logic Error","Fix: Changed loose equality (==) to strict equality (===) to prevent type coercion bugs."
"c3d4e5f6","perf: lazy load module","app.py","import heavy_module\n\ndef my_view():\n  # ...","def my_view():\n  import heavy_module\n  # ...","-import heavy_module","+  import heavy_module","Performance","Perf: Improved application startup time by moving a heavy module import inside the function that uses it."
"d5e6f7a8","fix: json serialization for datetime","api/v1/serializers.py","def serialize_post(post):\n  return {'title': post.title, 'created_at': post.created_at}","import json\nfrom datetime import datetime\n\ndef json_converter(o):\n    if isinstance(o, datetime):\n        return o.isoformat()\n\ndef serialize_post(post):\n  return json.dumps({'title': post.title, 'created_at': post.created_at}, default=json_converter)","+import json\n+from datetime import datetime\n+\n+def json_converter(o):\n+    if isinstance(o, datetime):\n+        return o.isoformat()\n\n-  return {'title': post.title, 'created_at': post.created_at}\n+  return json.dumps({'title': post.title, 'created_at': post.created_at}, default=json_converter)","Serialization Error","Fix: Added a JSON serializer to handle datetime objects, preventing TypeError."
"e7f8a9b0","fix: ensure directory exists before writing file","utils/file_handler.py","def write_log(path, content):\n  with open(path, 'w') as f:\n    f.write(content)","import os\n\ndef write_log(path, content):\n  os.makedirs(os.path.dirname(path), exist_ok=True)\n  with open(path, 'w') as f:\n    f.write(content)","+import os\n+\n-def write_log(path, content):\n+def write_log(path, content):\n+  os.makedirs(os.path.dirname(path), exist_ok=True)","File I/O Error","Fix: Ensured parent directory exists before writing a file to prevent FileNotFoundError."
"f9a0b1c2","refactor(api): rename endpoint for clarity","api/v2/routes.py","@app.route('/getstuff')\ndef get_stuff():\n  ...","@app.route('/get_user_posts')\ndef get_user_posts():\n  ...","-@app.route('/getstuff')\n-def get_stuff():\n+@app.route('/get_user_posts')\n+def get_user_posts():","Refactoring","Refactor: Renamed API endpoint from '/getstuff' to '/get_user_posts' for better readability."
"a1b3c5d7","fix: incorrect return type hint","core/types.py","def get_id(user) -> str:\n  return user.id # user.id is an int","def get_id(user) -> int:\n  return user.id","-def get_id(user) -> str:\n+def get_id(user) -> int:","Typing Error","Fix: Corrected the return type hint from str to int to match the actual return type."
"b2c4d6e8","fix: forgot to close file handle","scripts/importer.py","def process_file(filename):\n  f = open(filename, 'r')\n  return f.read()","def process_file(filename):\n  with open(filename, 'r') as f:\n    return f.read()","-  f = open(filename, 'r')\n-  return f.read()\n+  with open(filename, 'r') as f:\n+    return f.read()","Resource Leak","Fix: Used a 'with' statement to ensure the file handle is properly closed, preventing a resource leak."
"c4d6e8f0","fix: mutable default argument","utils/helpers.py","def add_to_list(item, my_list=[]):\n  my_list.append(item)\n  return my_list","def add_to_list(item, my_list=None):\n  if my_list is None:\n    my_list = []\n  my_list.append(item)\n  return my_list","-def add_to_list(item, my_list=[]):\n+def add_to_list(item, my_list=None):\n+  if my_list is None:\n+    my_list = []","Logic Error","Fix: Corrected the dangerous mutable default argument bug by initializing the list to None."
"d6e8f0a2","feat: add logging to user creation","services/user_service.py","def create_user(data):\n  # create user\n  return new_user","import logging\n\ndef create_user(data):\n  logging.info(f\"Creating user {data['username']}\")\n  # create user\n  return new_user","+import logging\n+\n-def create_user(data):\n+def create_user(data):\n+  logging.info(f\"Creating user {data['username']}\")","Feature","Feat: Added an informational log statement upon user creation for better traceability."
"e8f0a2b4","fix: race condition in counter","services/counter.js","let count = 0;\nfunction increment() {\n  count++;\n}","const lock = new Lock();\nlet count = 0;\nasync function increment() {\n  await lock.acquire();\n  count++;\n  lock.release();\n}","+const lock = new Lock();\n-let count = 0;\n-function increment() {\n+let count = 0;\n+async function increment() {\n+  await lock.acquire();\n   count++;\n+  lock.release();\n }","Concurrency","Fix: Implemented a lock to prevent a race condition when incrementing a shared counter."
"f0a2b4c6","fix: unhandled promise rejection","client/app.js","fetch('/api/data').then(res => res.json());","fetch('/api/data')\n  .then(res => res.json())\n  .catch(err => console.error('Failed to fetch data', err));","-fetch('/api/data').then(res => res.json());\n+fetch('/api/data')\n+  .then(res => res.json())\n+  .catch(err => console.error('Failed to fetch data', err));","Error Handling","Fix: Added a .catch() block to handle potential promise rejections from the fetch API call."
"a2b4c6d8","refactor: extract method","processing/main.py","def process_report():\n  # 20 lines of code to format data\n  data = formatted_data\n  # 15 lines of code to send email\n  send_email(data)","def _format_data(raw_data):\n  # 20 lines of code to format data\n  return formatted_data\n\ndef process_report():\n  data = _format_data(raw_data)\n  # 15 lines of code to send email\n  send_email(data)","+(... Refactored code ...)","Refactoring","Refactor: Extracted data formatting logic into a separate private method _format_data for improved modularity."
"b4c6d8e0","fix: regex catastrophic backtracking","utils/validator.js","const regex = /(x+x+)+y/;\n","const regex = /x{2,}y/;\n","-const regex = /(x+x+)+y/;\n+const regex = /x{2,}y/;\n","Performance","Fix: Corrected a regular expression that was vulnerable to catastrophic backtracking, causing potential DoS."
"c6d8e0f2","fix: wrong variable used in loop","data/aggregator.py","total_sales = 0\nfor product in products:\n  total_sales += product.price\nreturn total_sales","total_sales = 0\nfor transaction in transactions:\n  total_sales += transaction.amount\nreturn total_sales","-for product in products:\n-  total_sales += product.price\n+for transaction in transactions:\n+  total_sales += transaction.amount","Logic Error","Fix: Corrected loop to iterate over 'transactions' instead of 'products' to calculate total sales amount."
"d8e0f2a4","style: adhere to black formatter","models/user.py","def get_full_name(self):\n    return f'{self.first_name} {self.last_name}'","def get_full_name(self):\n    return f\"{self.first_name} {self.last_name}\"","-    return f'{self.first_name} {self.last_name}'\n+    return f\"{self.first_name} {self.last_name}\"","Style","Style: Ran Black code formatter, changing single quotes to double quotes."
"e0f2a4b6","fix: incorrect environment variable name","config/settings.py","DB_URL = os.environ.get('DATABASE_URL')","DB_URL = os.environ.get('POSTGRES_DB_URL')","-DB_URL = os.environ.get('DATABASE_URL')\n+DB_URL = os.environ.get('POSTGRES_DB_URL')","Configuration","Fix: Corrected the environment variable name used for the database connection string."